{"protocol_version":1,"job_id":"j_0042","kind":"segment","project_dir":"/tmp/bcoa-fixture/Study.bcoaproj","log_path":"/tmp/bcoa-fixture/Study.bcoaproj/logs/j_0042.log","resources_dir":"/Applications/BCOAnalyzer.app/Contents/Resources","payload":{"series_key":"s_0003","input_nifti":"work/s_0003/ct.nii.gz","models":["clin_ct_organs","clin_ct_vertebrae"],"device":"auto","retry_on_cpu":true,"labels_dir":"work/s_0003/runs/R20261002T120000/labels"}}
