{"protocol_version":1,"job_id":"j_0304","kind":"viewer_cache","project_dir":"/tmp/bcoa-fixture/Study.bcoaproj","log_path":"/tmp/bcoa-fixture/Study.bcoaproj/logs/j_0304.log","resources_dir":"/Applications/BCOAnalyzer.app/Contents/Resources","payload":{"series_key":"s_000003","ct":"work/s_000003/ct.nii","labelmaps":{"clin_ct_organs":"work/s_000003/labels/clin_ct_organs.nii.gz"}}}
