{"protocol_version":1,"job_id":"j_0107","kind":"export","project_dir":"/tmp/bcoa-fixture/Study.bcoaproj","log_path":"/tmp/bcoa-fixture/Study.bcoaproj/logs/j_0107.log","resources_dir":"/Applications/BCOAnalyzer.app/Contents/Resources","payload":{"run_id":"R20261002T120000","stem":"Study 2026-10-02 wide","options":{"format":"xlsx","layout":"wide","row_level":"patient","multiple_studies":"suffix","multiple_series":"primary","qc":"exclude","identifiers":"pseudonym","dates":"days_since_first","models":["clin_ct_organs","clin_ct_body_composition"],"methods_text":true,"masks":false}}}
