{"protocol_version":1,"job_id":"j_0303","kind":"metrics","project_dir":"/tmp/bcoa-fixture/Study.bcoaproj","log_path":"/tmp/bcoa-fixture/Study.bcoaproj/logs/j_0303.log","resources_dir":"/Applications/BCOAnalyzer.app/Contents/Resources","payload":{"series_key":"s_000003","ct":"work/s_000003/ct.nii","labelmaps":{"clin_ct_organs":"work/s_000003/runs/R20261002T120000/labels/clin_ct_organs.nii.gz"},"devices":{"clin_ct_organs":{"device":"mps","fallback":false}},"flags":["thick_slices"]}}
