{"protocol_version":1,"job_id":"j_0301","kind":"convert","project_dir":"/tmp/bcoa-fixture/Study.bcoaproj","log_path":"/tmp/bcoa-fixture/Study.bcoaproj/logs/j_0301.log","resources_dir":"/Applications/BCOAnalyzer.app/Contents/Resources","payload":{"series_key":"s_000003","catalog":"index/catalog.sqlite","catalog_id":"3f2a9c41d7e84b0c9a6e5d1f20b47c88","part_ref":15,"sources":[{"source_id":1,"root":"/Volumes/Share/Cohort A","status":"active","volume_kind":"network"},{"source_id":2,"root":null,"status":"unavailable"}]}}
